[
    {
        "id":  "eq_bixie_sword",
        "name":  "Swift Evil Sword",
        "type":  "weapon",
        "element":  "fire",
        "rarity":  "orange",
        "description":  "Crits grant a short berserk buff.",
        "effects":  [
                                {
                                    "op":  "stat_add",
                                    "stat":  "atk",
                                    "value":  110
                                },
                                {
                                    "op":  "attack_speed_bonus",
                                    "value":  0.15
                                }
                            ],
        "trigger":  {
                        "type":  "on_crit",
                        "chance":  1.0,
                        "cooldown":  0,
                        "effects":  [
                                        {
                                            "op":  "buff_self",
                                            "buff_id":  "buff_berserk",
                                            "duration":  6.0
                                        }
                                    ]
                    },
        "linkage_tags":  [

                         ]
    },
    {
        "id":  "eq_duchangjian",
        "name":  "Poison Blade",
        "type":  "weapon",
        "element":  "wood",
        "rarity":  "purple",
        "description":  "Hits may apply poison and deal extra damage to poisoned targets.",
        "effects":  [
                                {
                                    "op":  "stat_add",
                                    "stat":  "atk",
                                    "value":  85
                                },
                                {
                                    "op":  "damage_amp_vs_debuffed",
                                    "value":  0.20,
                                    "require_debuff":  "tangmen_poison"
                                }
                            ],
        "trigger":  {
                        "type":  "on_attack_hit",
                        "chance":  0.25,
                        "cooldown":  2.0,
                        "effects":  [
                                        {
                                            "op":  "debuff_target",
                                            "buff_id":  "tangmen_poison",
                                            "duration":  4.0
                                        }
                                    ]
                    },
        "linkage_tags":  [

                         ]
    },
    {
        "id":  "eq_hanbingmian",
        "name":  "Frostmail",
        "type":  "armor",
        "element":  "water",
        "rarity":  "orange",
        "description":  "Can freeze attackers and create ice terrain.",
        "effects":  [
                                {
                                    "op":  "stat_add",
                                    "stat":  "def",
                                    "value":  100
                                },
                                {
                                    "op":  "stat_add",
                                    "stat":  "idr",
                                    "value":  60
                                }
                            ],
        "trigger":  {
                        "type":  "on_attacked",
                        "chance":  0.15,
                        "cooldown":  8.0,
                        "effects":  [
                                        {
                                            "op":  "freeze_target",
                                            "duration":  2.0
                                        },
                                        {
                                            "op":  "create_terrain",
                                            "terrain_type":  "ice",
                                            "radius":  2,
                                            "duration":  8.0
                                        }
                                    ]
                    },
        "linkage_tags":  [

                         ]
    },
    {
        "id":  "eq_liuhuoyi",
        "name":  "Flame Armor",
        "type":  "armor",
        "element":  "fire",
        "rarity":  "orange",
        "description":  "Reflects damage and burns nearby enemies.",
        "effects":  [
                                {
                                    "op":  "stat_add",
                                    "stat":  "def",
                                    "value":  90
                                },
                                {
                                    "op":  "thorns_percent",
                                    "value":  0.20
                                }
                            ],
        "trigger":  {
                        "type":  "on_attacked",
                        "chance":  0.20,
                        "cooldown":  5.0,
                        "effects":  [
                                        {
                                            "op":  "debuff_aoe",
                                            "buff_id":  "debuff_burn",
                                            "radius":  2,
                                            "duration":  4.0
                                        },
                                        {
                                            "op":  "burn_ground",
                                            "radius":  2,
                                            "damage_per_second":  15,
                                            "duration":  5.0
                                        }
                                    ]
                    },
        "linkage_tags":  [

                         ]
    },
    {
        "id":  "eq_pojia_chuizi",
        "name":  "Armor Break Hammer",
        "type":  "weapon",
        "element":  "earth",
        "rarity":  "purple",
        "description":  "Hits can apply armor break.",
        "effects":  [
                                {
                                    "op":  "stat_add",
                                    "stat":  "atk",
                                    "value":  90
                                }
                            ],
        "trigger":  {
                        "type":  "on_attack_hit",
                        "chance":  0.30,
                        "cooldown":  0,
                        "effects":  [
                                        {
                                            "op":  "debuff_target",
                                            "buff_id":  "debuff_armor_break",
                                            "duration":  6.0
                                        }
                                    ]
                    },
        "linkage_tags":  [

                         ]
    },
    {
        "id":  "eq_xixue_jie",
        "name":  "Blood Ring",
        "type":  "accessory",
        "element":  "fire",
        "rarity":  "purple",
        "description":  "Grants life steal and MP on kill.",
        "effects":  [
                                {
                                    "op":  "vampire",
                                    "value":  0.15
                                },
                                {
                                    "op":  "mp_on_kill",
                                    "value":  30
                                }
                            ],
        "trigger":  {
                        "type":  "on_attack_hit",
                        "chance":  0.2,
                        "cooldown":  4,
                        "effects":  [
                                        {
                                            "op":  "buff_self",
                                            "buff_id":  "buff_bloodthirst",
                                            "duration":  5
                                        }
                                    ]
                    },
        "linkage_tags":  [

                         ]
    },
    {
        "id":  "eq_huiqi_zhu",
        "name":  "Qi Pearl",
        "type":  "accessory",
        "element":  "wood",
        "rarity":  "blue",
        "description":  "Can cleanse self and heal after being attacked.",
        "effects":  [
                                {
                                    "op":  "mp_regen_add",
                                    "value":  4.0
                                },
                                {
                                    "op":  "tenacity",
                                    "value":  0.20
                                }
                            ],
        "trigger":  {
                        "type":  "on_attacked",
                        "chance":  0.30,
                        "cooldown":  10.0,
                        "effects":  [
                                        {
                                            "op":  "cleanse_self"
                                        },
                                        {
                                            "op":  "heal_self_percent",
                                            "value":  0.10
                                        }
                                    ]
                    },
        "linkage_tags":  [

                         ]
    },
    {
        "id":  "eq_zhanshen_kai",
        "name":  "War God Armor",
        "type":  "armor",
        "element":  "metal",
        "rarity":  "red",
        "description":  "Start with shield and gain undying at low HP.",
        "effects":  [
                                {
                                    "op":  "stat_add",
                                    "stat":  "def",
                                    "value":  200